{
  "$schema": "https://json-schema.org/draft/2020-12/schema",
  "$id": "https://metaviewer.local/contracts/v0.2/capsule_meta.schema.json",
  "title": "Capsule Meta",
  "description": "Normalized capsule metadata from the daemon adapter; paths and sockets come from capsule metadata, never guessed.",
  "type": "object",
  "properties": {
    "schema": {
      "const": "capsule_meta/v0.2"
    },
    "surface_id": {
      "type": "string",
      "minLength": 1,
      "maxLength": 128,
      "pattern": "^[A-Za-z0-9][A-Za-z0-9._:-]*$"
    },
    "kind": {
      "type": "string",
      "enum": [
        "browser",
        "program",
        "desktop_capsule",
        "game_capsule",
        "vm"
      ],
      "maxLength": 65536
    },
    "container": {
      "type": "string",
      "minLength": 1,
      "maxLength": 128,
      "pattern": "^[A-Za-z0-9][A-Za-z0-9._:-]*$"
    },
    "run_id": {
      "type": "string",
      "minLength": 1,
      "maxLength": 128,
      "pattern": "^[A-Za-z0-9][A-Za-z0-9._:-]*$"
    },
    "display": {
      "type": "string",
      "minLength": 1,
      "maxLength": 256
    },
    "fb_path": {
      "type": "string",
      "minLength": 1,
      "maxLength": 4096,
      "pattern": "^/dev/shm/[^\\u0000\\r\\n]+$"
    },
    "lane_socket": {
      "type": "string",
      "minLength": 1,
      "maxLength": 4096,
      "pattern": "^/[^\\u0000\\r\\n]*$"
    },
    "ready_line": {
      "type": "string",
      "minLength": 1,
      "maxLength": 256
    },
    "windows": {
      "type": "array",
      "minItems": 1,
      "maxItems": 16,
      "items": {
        "type": "object",
        "properties": {
          "window_id": {
            "type": "string",
            "minLength": 1,
            "maxLength": 128,
            "pattern": "^[A-Za-z0-9][A-Za-z0-9._:-]*$"
          },
          "x_px": {
            "type": "integer",
            "minimum": 0,
            "maximum": 16383
          },
          "y_px": {
            "type": "integer",
            "minimum": 0,
            "maximum": 16383
          },
          "width_px": {
            "type": "integer",
            "minimum": 1,
            "maximum": 16384
          },
          "height_px": {
            "type": "integer",
            "minimum": 1,
            "maximum": 16384
          }
        },
        "required": [
          "window_id",
          "x_px",
          "y_px",
          "width_px",
          "height_px"
        ],
        "additionalProperties": false,
        "maxProperties": 256
      }
    }
  },
  "required": [
    "schema",
    "surface_id",
    "kind",
    "container",
    "run_id",
    "display",
    "fb_path",
    "ready_line",
    "windows"
  ],
  "additionalProperties": false,
  "maxProperties": 256
}
